<!ELEMENT menu (item+)>
<!ELEMENT item (name, description, price, image)>
<!ELEMENT name (#PCDATA)>
<!ELEMENT description (#PCDATA)>
<!ELEMENT price (#PCDATA)>
<!ELEMENT image (#PCDATA)>
